index,wav_file,old_name,segment_text,question,C1,C2,C3,C4,C_correct,summary,duration,training.thisRepN,training.thisTrialN,training.thisN,training.thisIndex,experiment.thisRepN,experiment.thisTrialN,experiment.thisN,experiment.thisIndex,thisRow.t,notes,Instructions.started,Instructions.stopped,Start_Segment_Train.started,Play_train.started,Trial_counter_train.started,text_5.started,Start_Segment_Train.stopped,Play_train.numClicks,Play_train.timesOn,Play_train.timesOff,Training_Segment.started,Experimen_audio.started,polygon.started,polygon.stopped,Training_Segment.stopped,Summary.started,textbox.started,summary_done.started,Summary.stopped,textbox.text,summary_done.numClicks,summary_done.timesOn,summary_done.timesOff,Start_Exp.started,Start_exp.started,Start.started,Start_Exp.stopped,Start.numClicks,Start.timesOn,Start.timesOff,Start_Segment.started,Play.started,Trial_counter.started,text_6.started,Start_Segment.stopped,Play.numClicks,Play.timesOn,Play.timesOff,Thanks.started,text_7.started,text_7.stopped,Thanks.stopped,participant,session,date,expName,psychopyVersion,frameRate,expStart,
1,Someday_trial_condition.wav,Someday__Someday__Maybe__Unabridged___File_069_of_116_3.wav,It's a gut feeling You can't nickname him He's a real person not a joke person You don't have to tell me Only a real person would try to shake hands with my best friend's foot Jane you're not explaining it right It was very romantic And thankfully our steaming bowl of bright yellow melted cheese with flecks of green chilies arrives Listen she says dipping a chip into the creamy depths You're the one with the brand new personality I'm still the same old Jane,"What does the narrator have, according to Jane?",A) A new recipe for dipping sauce,B) A new personality,C) A new restaurant suggestion,D) A new pair of shoes,B) A new personality,yes,30,0,0,0,0,,,,,37.165102583000134,,0.010667000000012195,37.13959483300005,37.149523583000246,37.165102583000134,37.165102583000134,37.165102583000134,39.62110212500011,1,[2.463429959000223],[2.463432584000202],39.62149233300033,39.67072904100023,39.66542287500033,69.69425454100019,69.64983908300019,69.671314833,69.69425454100019,69.69425454100019,96.45768112499991,somehing about yellow depths personality and same old jane,1,[26.773138958000345],[26.77314137500025],,,,,,,,,,,,,,,,,,,,p_2,001,2024-03-28_10h21.50.055,speech_rate,2023.2.3,None,2024-03-28 10h25.24.758483 -0700,
2,Someday_trial_condition-4x.wav,Someday__Someday__Maybe__Unabridged___File_103_of_116_1.wav,Isn't halfway where two people usually meet Well in general maybe But tonight this is sort of a big deal for me It's my night I'm not sure you you don't think I get it Well no I mean how could you I'm having trouble making sense of this conversation James is speaking with authority but there's something wrong Something feels so wrong somehow I don't care about waving and smiling and having my picture taken with him,"How does James speak, according to the narrator?",A) With compassion,B) With grief,C) With hesitation,D) With authority,D) With authority,yes,7.5,0,1,1,1,,,,,96.4684487909999,,,,96.45815666599992,96.4684487909999,96.4684487909999,96.4684487909999,104.97227079100003,1,[8.510227833000044],[8.510237708000204],104.97260029100016,104.98524591666661,104.98609475000012,112.5057347500001,112.48560145800002,112.49680154099997,112.5057347500001,112.5057347500001,128.37548100000004,nothing makes sense,1,[15.87718920799989],[15.877191957999912],,,,,,,,,,,,,,,,,,,,p_2,001,2024-03-28_10h21.50.055,speech_rate,2023.2.3,None,2024-03-28 10h25.24.758483 -0700,
,Someday_142_condition-3-5x.wav,Someday__Someday__Maybe__Unabridged___File_088_of_116_2.wav,"Metro North is on strike. So I can't take the train I have no wallet. No driver's license. I can't pick up the rental car Two nights ago on the way home from James's I arrived at our front door Just as our downstairs neighbor was leaving and Dan and Jane were home with the door to our place already open So it wasn't until I went to get bagels the next morning that I realized in my rush to leave I forgot my purse at James's apartment. I left him a message, but he must have already taken off for Los Angeles",Where did the narrator forget her purse?,A. In the subway,B. In James's apartment,C. In the acting school,D. In the cab,B. In James's apartment,no,8.51471875,,,,,0,0,0,0,183.0560316250003,,,,,,,,,,,,185.04605308300006,185.0620073746666,185.06248462500025,193.572832458,193.5899695410003,193.60112325,193.60954312500007,193.60954312500007,214.93105462500034,They left something in Jane's apartment but they had to go to Los Angeles,1,[21.328581250000298],[21.328583833000266],128.37573650000013,128.38414679100015,128.38414679100015,182.97666800000025,1,[54.600162958000055],[54.6001655],183.04262295800027,183.0560316250003,183.0560316250003,183.0560316250003,185.0457018750003,1,[1.9998066660000404],[1.9998092499999984],,,,,p_2,001,2024-03-28_10h21.50.055,speech_rate,2023.2.3,None,2024-03-28 10h25.24.758483 -0700,
,Someday_20_condition.wav,Someday__Someday__Maybe__Unabridged___File_012_of_116_1.wav,Upstairs the waiting room is crowded which means there must be a few different casting calls There are boys and girls near the age of the elevator twins a couple of men in their 50s both in suit and tie and several girls who remind me of me but a better more put together me the me who would play me in the TV movie of the fictional life of the real me I sign in Name time arrived time scheduled agency social security number,What observation does the narrator make about the individuals in the waiting room?,A. They are all likely there for the same casting call,B. They are unorganized and scattered,"C. They appear to be different versions of the narrator, better and more composed",D. They are unrelated to the narrator's field of work,"C. They appear to be different versions of the narrator, better and more composed",no,27.41,,,,,0,1,1,1,214.94036200000028,,,,,,,,,,,,217.71188145800033,217.74131933333325,217.74310695800023,245.14826754100022,245.1524370410002,245.1738291659999,245.1826408750003,245.1826408750003,300.00257979100024,"The person sees different people, elevator twins and girls who remind her of her who would play her in a fictional show about her. She signs in with agency and social security number.",1,[54.82734375000018],[54.82734633300015],,,,,,,,214.931679583,214.94036200000028,214.94036200000028,214.94036200000028,217.7115832909999,1,[2.777635458000077],[2.777644875000078],,,,,p_2,001,2024-03-28_10h21.50.055,speech_rate,2023.2.3,None,2024-03-28 10h25.24.758483 -0700,
,Someday_91_condition-4x.wav,Someday__Someday__Maybe__Unabridged___File_040_of_116_0.wav,Please go ahead and begin your monologue whenever you're ready We can chat afterwards Take your time His words are encouraging but his face is neutral at best And when there are two people in a room and one of them is there purely to see the other person do something the notion that that person could actually take their time seems ridiculous But I try I try to take a deep breath but the air gets sort of stuck and doesn't go all the way down to my lungs I need a minute to calm down but I can't possibly take it,What is the narrator's reaction to the suggestion to take her time?,A. She feels comforted,B. She finds it ridiculous,C. She rejects the offer,D. She chats with the agent first,B. She finds it ridiculous,yes,7.1475,,,,,0,2,2,2,300.0100707910001,,,,,,,,,,,,303.61742170800017,303.6329957076666,303.6305768330003,310.77927820800005,310.78195191600025,310.80354345800015,310.814201916,310.814201916,322.75354991600034,She tries to take a deep breath and she cannot believe it. ,1,[11.946861542000079],[11.946864042000016],,,,,,,,300.0029665830002,300.0100707910001,300.0100707910001,300.0100707910001,303.6171953329999,1,[3.613756208000268],[3.613758792000226],,,,,p_2,001,2024-03-28_10h21.50.055,speech_rate,2023.2.3,None,2024-03-28 10h25.24.758483 -0700,
,Someday_33_condition-2-5x.wav,Someday__Someday__Maybe__Unabridged___File_018_of_116_2.wav,Well I wouldn't say I'd be amazing in it although thanks for saying so I think I'd just be okay in it I mean it is sort of right in my wheelhouse but I think you'd actually be great in it I'm serious I mean I could do it I guess and I probably would do it if they asked but I think my problem with it isn't the play itself but the guy who's in it now What's his name Anyway it doesn't matter I just think he's not really acting so much as just smoldering or something up there and I'm like buddy you can't just play every scene sexy I mean that's not an active choice,What issue does the narrator have with the actor currently in the play?,A. She thinks he's too active,B. She believes he's too serious,C. She thinks he's smoldering too much,D. She has no issue with him,C. She thinks he's smoldering too much,no,13.365625,,,,,0,3,3,3,322.7625121250003,,,,,,,,,,,,327.2013765830002,327.2308431243332,327.2215983750002,340.58121654100023,340.5993617500003,340.6216830000003,340.6301511659999,340.6301511659999,383.1402350000003,She's talking about how another actor is just okay and calls him buddy. He cannot always play sexy and smoulder. It's not an active choice. ,1,[42.51712941599999],[42.51713212499999],,,,,,,,322.7539032499999,322.7625121250003,322.7625121250003,322.7625121250003,327.20109245799995,1,[4.44512529099984],[4.445130125000105],,,,,p_2,001,2024-03-28_10h21.50.055,speech_rate,2023.2.3,None,2024-03-28 10h25.24.758483 -0700,
,Someday_139_condition-2-5x.wav,Someday__Someday__Maybe__Unabridged___File_081_of_116_1.wav,"Sorry, you guys says Dan I suck. I don't know how actors do it. I want to help Can I just read this next scene to myself first before we do it out loud? Of course I say to him generously then I turn to Jane and roll my eyes these method actors Here you go. Mr. James Dean sir says Jane handing him a single sheet of paper. It's just the one page What a drama queen he is don't quit your day job Danny Dan pours over the single sheet holding it tightly on either side.",What does the narrator do when she turns to Jane?,A. She rolls her eyes,B. She smiles,C. She winks,D. She nods,A. She rolls her eyes,no,13.749,,,,,0,4,4,4,383.15032062499995,,,,,,,,,,,,384.37192400000004,384.38749766666683,384.391782875,398.13371725000025,398.1395377910003,398.15068254100015,398.159348875,398.159348875,422.1923610829999,She apologizes and wants to look at the script to go over it. ,1,[24.040374000000156],[24.040376541000114],,,,,,,,383.14061791600034,383.15032062499995,383.15032062499995,383.15032062499995,384.3717033329999,1,[1.2280894999998964],[1.2280922499999178],,,,,p_2,001,2024-03-28_10h21.50.055,speech_rate,2023.2.3,None,2024-03-28 10h25.24.758483 -0700,
,Someday_65_condition-3x.wav,Someday__Someday__Maybe__Unabridged___File_032_of_116_0.wav,From the minute I walk into the wardrobe fitting in a trailer near mine I'm confused There are two giant rolling racks one full of tan trousers one stuffed with 30 or 40 identical blue shirts Oh Are there are there more people coming I ask a harried looking woman nearby She looks at me as though I've said something strange what oh the racks No those are all for you But aren't these all the same pants I say laughing a little,What does the narrator find confusing in the wardrobe fitting?,A. The lack of clothing options,B. The number of people there,C. The presence of a harried woman,D. The identical blue shirts and tan trousers,D. The identical blue shirts and tan trousers,yes,10.53375,,,,,0,5,5,5,422.2006759579999,,,,,,,,,,,,428.10948254100003,428.125469041667,428.12785008300034,438.6698324580002,438.6719387080002,438.6942738329999,438.70515987499994,438.70515987499994,465.4784830409999,She goes into the trailer and sees trousers and talks to another lady about her confusion. The lady says they're all for you. ,1,[26.78225245800013],[26.782254916000056],,,,,,,,422.192675625,422.2006759579999,422.2006759579999,422.2006759579999,428.1092946250001,1,[5.916136999999708],[5.916139624999687],,,,,p_2,001,2024-03-28_10h21.50.055,speech_rate,2023.2.3,None,2024-03-28 10h25.24.758483 -0700,
,Someday_39_condition-3-5x.wav,Someday__Someday__Maybe__Unabridged___File_021_of_116_1.wav,People who are admired for holding it together are not people who are about to get agents They're people who are recovering from cancer or undergoing a murder trial And I dropped a section I add hoping he'll say he didn't notice Yeah I know but I only know because I'm obsessed with that guy's work No one will dock you for that It's not exactly a glowing review but he doesn't seem totally horrified Still he's avoiding the thing I most want to know But when I fell I mean how bad was it,What does the narrator hope the person they are talking to will say?,A. That he didn't notice the mistake,B. That he noticed the dropped section,C. That he wants to be an agent,D. That he's obsessed with the narrator's work,A. That he didn't notice the mistake,no,9.134375,,,,,0,6,6,6,465.48834341600013,,,,,,,,,,,,469.5143404160003,469.5280389996667,469.5298471660003,478.660150791,478.6629951250002,478.6740782080001,478.68287041600024,478.68287041600024,492.51346145800017,She was horrified and takes a deep breath. That was it. ,1,[13.837968416999956],[13.837973917],,,,,,,,465.47882441599995,465.48834341600013,465.48834341600013,465.48834341600013,469.5138538750002,1,[4.031175167000129],[4.031185667000045],,,,,p_2,001,2024-03-28_10h21.50.055,speech_rate,2023.2.3,None,2024-03-28 10h25.24.758483 -0700,
,Someday_103_condition.wav,Someday__Someday__Maybe__Unabridged___File_045_of_116_1.wav,So I let it soften back down to the small giggle and finally exhausted but happy I let out a little sigh that's interrupted by an almost involuntary hiccup like I gulp down too much champagne all at once It's a blur from that point on a series of snapshots that flashed before me The woman in the back mouthing see to the disgruntled man who nods and shrugs at her in a way That says who knew and the man in glasses asking me to wait in the waiting room,What happens after the narrator finishes their audition?,A. She is congratulated by the casting director,B. She is asked to perform the laugh again,C. She is asked to wait in the waiting room,D. She is immediately given the role,C. She is asked to wait in the waiting room,no,28.64,,,,,0,7,7,7,492.5232943330002,,,,,,,,,,,,494.47348012500015,494.50607537433325,494.50549954100006,523.1580425830002,523.160066333,523.1816319160002,523.1904385410003,523.1904385410003,565.9337914160001,"She hiccups like she has a full glass of champagne. And the man in the waiting room says, "who knew."",1,[42.75070029199969],[42.7507029999997],,,,,,,,492.5137855410003,492.5232943330002,492.5232943330002,492.5232943330002,494.47329416599996,1,[1.9567288329999428],[1.9567315409999537],,,,,p_2,001,2024-03-28_10h21.50.055,speech_rate,2023.2.3,None,2024-03-28 10h25.24.758483 -0700,
,Someday_2_condition-3x.wav,Someday__Someday__Maybe__Unabridged___File_004_of_116_1.wav,Successful actresses are disciplined people who wake up early to focus on their craft I told myself even ones who still make their living as waitresses like me I started leaving the alarm clock on the landing between Jane's room and mine so I'd have to actually get out of bed in order to turn it off instead of hitting snooze over and over like I normally do I also resolved to quit smoking again to stop losing purses wallets and umbrellas and to not eat any more cheese puffs not even on special occasions,What resolution does the narrator make about her lifestyle to become a successful actress?,A. To wake up early and focus on her craft,B. To quit smoking and stop losing personal items,"C. To stop eating cheese puffs, even on special occasions",D. All of the above,D. All of the above,no,11.38125,,,,,0,8,8,8,565.9429600830003,,,,,,,,,,,,569.0674584160001,569.0834205826666,569.0842944999999,580.4878412910002,580.4673825,580.4785984160003,580.4878412910002,580.4878412910002,616.7367192910001,She's talking about how actors need to be disciplined and that she can only eat cheese puffs on special occasions. and she cannot hit snooze on her alarm clock. ,1,[36.256602250000014],[36.25660462499991],,,,,,,,565.9341033330002,565.9429600830003,565.9429600830003,565.9429600830003,569.0672827500002,1,[3.1326823750000585],[3.132685041000059],,,,,p_2,001,2024-03-28_10h21.50.055,speech_rate,2023.2.3,None,2024-03-28 10h25.24.758483 -0700,
,Someday_52_condition-4x.wav,Someday__Someday__Maybe__Unabridged___File_026_of_116_0.wav,She takes a deep breath and narrows her eyes and says slowly and deliberately I won't until I get something on my favorite show Law and Order You've never been on Law and Order I say surprised but you're perfect for it I know I'm even Irish and Italian Who knows cops and criminals better So why You haven't auditioned for them or People known for being on the most ridiculed talking animals show of the last decade sometimes have a hard time being taken seriously,What show does Dina want to get a role on?,A. "Law and Order",B. "There's Pierre",C. The talking animals show,D. A show about Irish and Italian people,A. "Law and Order",no,7.215,,,,,0,9,9,9,616.746439125,,,,,,,,,,,,618.3853235410002,618.4008228746668,618.4000665410003,625.6137291250002,625.6180854160002,625.6292979160003,625.6384705,625.6384705,648.705325375,She might have asked someone  if she's watched the show law and order and that she cannot be taken seriously. ,1,[23.074547500000335],[23.074550000000272],,,,,,,,616.7370342910003,616.746439125,616.746439125,616.746439125,618.3850790410002,1,[1.6452734160002365],[1.6452763330003108],,,,,p_2,001,2024-03-28_10h21.50.055,speech_rate,2023.2.3,None,2024-03-28 10h25.24.758483 -0700,
,Someday_8_condition-4x.wav,Someday__Someday__Maybe__Unabridged___File_007_of_116_1.wav,And one accomplishment a year wasn't exactly what I had in mind Still wedged halfway beneath the bed it takes all my strength to push a barely used roller blade out of the way At this point I'm just sweeping my arm back and forth making the same movement under my bed as I would if making a snow angel only the accumulated junk is a lot harder to move I give up for a moment resting my cheek against the cool wooden floor with a sigh Do you have any idea how few actors make it people always say,What does the narrator push out of the way?,A. Roller blades,B. Snow angel drawings,C. Junk that's hard to move,D. Cool wooden floor,A. Roller blades,no,7.295,,,,,0,10,10,10,648.7147555000001,,,,,,,,,,,,649.8359754160001,649.8490868746669,649.8497456250002,657.149031291,657.1512322500002,657.1624535410001,657.1714901250002,657.1714901250002,665.105851416,Could not understand. ,1,[7.941911291999986],[7.941913708000357],,,,,,,,648.7056400410002,648.7147555000001,648.7147555000001,648.7147555000001,649.835754708,1,[1.1273624170003131],[1.1273662920002607],,,,,p_2,001,2024-03-28_10h21.50.055,speech_rate,2023.2.3,None,2024-03-28 10h25.24.758483 -0700,
,Someday_12_condition-3-5x.wav,Someday__Someday__Maybe__Unabridged___File_008_of_116_4.wav,Of course the wedding's not until June but if you wanna stay at the Sands by the shore she said to book early Okay thanks Franny I'm worried about you Why Well from my initial calculations this new telephone identification system could save you upwards of 20 to 25 seconds per day I'm concerned about how you'll adjust to all the new free time Har har Also one of my students says there's a show called Friends Apparently it's a popular one Maybe you should try to apply for that,What does the narrator's father joke about regarding caller ID?,A. The invention of the telephone,B. The inconvenience of caller ID,C. The potential time saved with caller ID,D. The popularity of caller ID,C. The potential time saved with caller ID,no,9.2875,,,,,0,11,11,11,665.1151235000002,,,,,,,,,,,,666.1728281250003,666.1887702916667,666.1878887080002,675.4832394160003,675.4855505410001,675.4967664579999,675.5061779580001,675.5061779580001,699.608124291,She's telling someone that one of her friends told her to apply for a show and that maybe they should apply for that. ,1,[24.109820292000222],[24.10982275000015],,,,,,,,665.1061785000002,665.1151235000002,665.1151235000002,665.1151235000002,666.1726543750001,1,[1.0659448330002306],[1.0659473330001674],,,,,p_2,001,2024-03-28_10h21.50.055,speech_rate,2023.2.3,None,2024-03-28 10h25.24.758483 -0700,
,Someday_69_condition-2x.wav,Someday__Someday__Maybe__Unabridged___File_033_of_116_3.wav,Mmm let me see Carol puts on the glasses that hang on a chain around her neck and brings her face just inches from mine I hold very still as if I'm being examined in a doctor's office Well you have some freckles it's true I don't think they're distracting though I don't see them as a problem but I can even out your skin tone if that's what concerns you Carol sighs I don't think she likes me Okay great whatever you think thanks Want a magazine,What does Carol suggest to the main character regarding her freckles?,A. Cover them up with makeup,B. Embrace them as unique,C. Remove them with a cream,D. Get freckle tattoos,A. Cover them up with makeup,no,14.785,,,,,0,12,12,12,699.6177428330002,,,,,,,,,,,,701.4420345410003,701.4579454996667,701.4629634160001,716.2523020829999,716.2547261250002,716.2766956250002,716.2856955410002,716.2856955410002,755.5281029160001,Someone has freckles that are too distracting. They might be at a skin appointment and she asks the person if they want a magazine and offers to even out her skin tone. ,1,[39.24990704100037],[39.24990962500033],,,,,,,,699.6084474580002,699.6177428330002,699.6177428330002,699.6177428330002,701.441849666,1,[1.8307574170003136],[1.830760167000335],,,,,p_2,001,2024-03-28_10h21.50.055,speech_rate,2023.2.3,None,2024-03-28 10h25.24.758483 -0700,
,Someday_141_condition.wav,Someday__Someday__Maybe__Unabridged___File_088_of_116_1.wav,"Pink eye I keep repeating the phrase as if that will somehow make it disappear from Jane's face pink eye you have pink eye How can you be sure? Well by looking in the mirror for one thing, but maybe you just have something in your eye or allergies. Sorry Franny I've had it before this is what it looks like. It's really contagious. There's no way I can go Jane was going to be my date for Katie's wedding Jane had arranged the rental car in her name Jane has pink eye if you can't go I can't go",What does Jane have?,A. Cold,B. Pink eye,C. Flu,D. Bruises,B. Pink eye,yes,30.02221875,,,,,0,13,13,13,755.5376635830003,,,,,,,,,,,,756.146101375,756.1952991250002,756.1885509580002,786.2052315000001,786.2233265,786.234435458,786.2413218330003,786.2413218330003,819.5652775410003,"Jane has pink eye. It's not allergies and if she cannot go, then the speaker cannot go. Jane arranged for the car. ",1,[33.329563290999886],[33.329565915999865],,,,,,,,755.5284191250003,755.5376635830003,755.5376635830003,755.5376635830003,756.1459159579999,1,[0.6148729999999887],[0.6148756669999784],,,,,p_2,001,2024-03-28_10h21.50.055,speech_rate,2023.2.3,None,2024-03-28 10h25.24.758483 -0700,
,Someday_59_condition-2x.wav,Someday__Someday__Maybe__Unabridged___File_028_of_116_1.wav,It's all sort of a a vacuum isn't it Yes it can be I guess Everett isn't saying anything I haven't thought before but there's something so depressing in her description Something less than comforting in her attempt to be understanding in My work ever it says in mergers and amalgamations We're seeing a real boom Lbo's are still the cornerstone of the business obviously but the increase in global capital flows is translating to even more revenue,What does Everett's description sound like to the narrator?,A. Comforting,B. Understanding,C. Concerned,D. Depressing,D. Depressing,yes,14.995,,,,,0,14,14,14,819.5727729580003,,,,,,,,,,,,820.2963925829999,820.3118852076666,820.3162901660003,835.3436175410002,835.311929125,835.3341811250002,835.3436175410002,835.3436175410002,853.365073166,There's LBOs and global capital revenue. ,1,[18.029262790999837],[18.02926558299987],,,,,,,,819.5656161249999,819.5727729580003,819.5727729580003,819.5727729580003,820.2962056660003,1,[0.7299874999998792],[0.7299902079998901],,,,,p_2,001,2024-03-28_10h21.50.055,speech_rate,2023.2.3,None,2024-03-28 10h25.24.758483 -0700,
,Someday_131_condition-2-5x.wav,Someday__Someday__Maybe__Unabridged___File_058_of_116_1.wav,It sounds ominous For a minute I stare into the camera which is set up on a tripod facing the chair Then I realize that if the camera sees everything it's seeing me now stare dumbly into it I've had cameras at auditions before of course but for commercials you generally look directly into them a man versus machine staring contest Today however I'm going to be reading with a person while the camera regards me from another angle and I'm supposed to pretend that doesn't make me feel self conscious,How does the camera make the narrator feel?,A. Self conscious,B. Excited,C. Motivated,D. Emotional,A. Self conscious,yes,13.179875,,,,,0,15,15,15,853.3747052910003,,,,,,,,,,,,857.0172442080002,857.0331204166666,857.0362608750002,870.2383533330003,870.217749291,870.228964208,870.2383533330003,870.2383533330003,889.4528276660003,She's feeling self-conscious about the angle of the camera. ,1,[19.222269208999933],[19.22227174999989],,,,,,,,853.3655293750003,853.3747052910003,853.3747052910003,853.3747052910003,857.017065041,1,[3.6493689580001956],[3.649371541000164],,,,,p_2,001,2024-03-28_10h21.50.055,speech_rate,2023.2.3,None,2024-03-28 10h25.24.758483 -0700,
